|J. Cole| BRACKETS |(Intro: Richard Pryor) Lotta shit happens, like, being in show business A lot of shit happens, like, like, I make a lot of money, you know And I'm really happy about it And I'm not bragging, I just wanna say something I make a so--- fuck, it's ridiculous But wait, wait a minute, wait a minute Hey, if my father was alive today, I would go home and say "Dad, I wanna tell you how much money I made" You know what he'd say? You's a lying motherfucker Joe Lewis didn't make that much money Come in here, get your ass out the house Coming here with that bullshit, hah  Niggas hating on me, I ain't used to that Know a couple people wanna shoot for that I say "No, no, no, chill, it ain't no need for that" Them niggas tryna blow they don't need me for that And if it work for them, well shit, I'm cool with that 'Cause how they feel, I ain't got shit to do with that I just sit back on cool and watch my paper stack And trip off how much bread them crackers take from that  (Whoa whoa whoa whoa, yeah, yeah, yeah, yeah) (Whoa whoa whoa whoa, yeah, yeah, yeah, yeah) (Whoa whoa whoa whoa, yeah, yeah, yeah, yeah) (Whoa whoa whoa whoa, yeah, yeah, yeah, yeah)  It's been a long time since I have felt this way About something but now, but now I'm controlling my mind, the days are warm The nights are cold, the lost is found, I'm found Lord knows I need something to fill this void Lord knows I need something to fill this void Lord knows I need something to fill this void Lord knows I need something to fill this void  Hell yeah boy, I'm a goddamn millionaire now Hell yeah, nigga, they can't tell me shit now, bro, hell no, fuck that Bitch, got my first motherfuckin' million dollar check nigga I'm goddamn lit boy, you crazy as hell Hold up, it's my phone real quick, it's my Unc' Uncle Sam and shit "What's up Unc'? Yup. Hey, I told you that check was coming in, I gotchu when it came in. Goddamn, I'm a man of my word. Goddamn, I told you I'ma have it, and goddamn, I'ma have it for you. Hell, shit, damn right. Now, how much was it though? Uh huh. Huh? Half? Half nigga? You crazy, boy, you crazy. Bitch, you crazy as fuck. Bitch, bitch, you better suck half my dick!  Yeah, I pay taxes, so much taxes, shit don't make sense Where do my dollars go? You see lately, I ain't been convinced I guess they say my dollars supposed to build roads and schools But my niggas barely graduate, they ain't got the tools Maybe 'cause the tax dollars that I make sure I send Get spent hirin' some teachers that don't look like them And the curriculum be tricking them, them dollars I spend Got us learning about the heroes with the whitest of skin One thing about the men that's controlling the pen That write history, they always seem to white-out they sins Maybe we'll never see a black man in the White House again I'll write a check to the IRS, my pockets get slim Damn, do I even have a say 'bout where it's goin'? Some older nigga told me to start votin' I said "Democracy is too fuckin' slow" If I'm givin' y'all this hard-earned bread, I wanna know Better yet, let me decide, bitch, it's 2018 Let me pick the things I'm funding from an app on my screen Better that than letting wack congressman I've never seen Dictate where my money go, straight into the palms of some Money-hungry company that make guns that circulate the country And then wind up in my hood, making bloody clothes Stray bullet hit a young boy with a snotty nose From the concrete, he was prolly rose Now his body froze and nobody knows what to tell his mother He did good at the white man schools unlike his brother Who was lost in the streets all day, not using rubbers So right now, he got two on the way Still sleep on covers in his mama house She can't take this shit no more, she want him out On the morning of the funeral, just as she's walking out Wiping tears away, grabbing her keys and sunglasses She remember that she gotta file her taxes, damn  (Whoa whoa whoa whoa, yeah, yeah, yeah, yeah) (Whoa whoa whoa whoa, yeah, yeah, yeah, yeah) (Whoa whoa whoa whoa, yeah, yeah, yeah, yeah) (Whoa whoa whoa whoa, yeah, yeah, yeah, yeah)|
Avicii |The Nights| |Hey, once upon a younger year When all our shadows disappeared The animals inside came out to play Hey, went face to face with all our fears Learned our lessons through the tears Made memories we knew would never fade  One day my father-he told me "Son, don't let it slip away" He took me in his arms, I heard him say  "When you get older Your wild heart will live for younger days Think of me if ever you're afraid"  He said, "One day you'll leave this world behind So live a life you will remember" My father told me when I was just a child These are the nights that never die My father told me  When thunder clouds start pouring down Light a fire they can't put out Carve your name into those shining stars He said, "Go venture far beyond these shores Don't forsake this life of yours I'll guide you home no matter where you are"  One day my father-he told me "Son, don't let it slip away" When I was just a kid I heard him say  "When you get older Your wild heart will live for younger days Think of me if ever you're afraid"  He said, "One day you'll leave this world behind So live a life you will remember" My father told me when I was just a child These are the nights that never die My father told me  These are the nights that never die My father told me Hey, hey|
|Sean Paul| |Mad Love| |Jiggle up yuh body Jiggle up yuh sinting  Love me, love me like that Love me like we ain't never let go (How you mean?) Love me, love me like that Poco poco, muy, muy lento (Zeen!) Take your time and do it just like we were in Jamaica or New York (Woop, woop, woop, woop) Love me, love me like that Love me, give me some mad love  Watch the tempo, watch the tempo Watch the tempo, watch the tempo Watch the tempo, watch the tempo Love me, give me some mad love  Baby girl cau' me lovin' how your body fat Gimme some a dat Lovin' how your booty pop when the beat drop Come in my baby when you do it is a wrap Love the energy when you fling it up back Steppin' in gyal you pepparin', you ever look hot Epic win gyal, you know say you never yet flop I know I see weh mi wah fi attack Mi eye deh 'pon she, precise and exact  Good lord, girl, yuh going so hard (Woo) Girl your legs look the best when I'm spreadin' the two apart (Oh, yeah yeah yeah) Good lord, why you going so hard? (Do it, girl) Boy, I'm tryna to be good but you're making me be so bad (Bidi, bang, bang, bang) Love me, love me like that Love me like we ain't never let go (How you mean?) Love me, love me like that Poco poco, muy, muy lento (Zeen!) Take your time and do it just like we were in Jamaica or New York (Woop, woop, woop, woop) Love me, love me like that Love me, give me some mad love  Watch the tempo, watch the tempo Watch the tempo, watch the tempo Watch the tempo, watch the tempo Love me, give me some mad love (Bidi bang) Watch the tempo, watch the tempo Watch the tempo, watch the tempo Watch the tempo, watch the tempo (Woop, woop, woop, woop) Love me, give me some mad love (Bidi, bang, bang, bang)  Spin like a propeller you a da in ting Spin my girl, cau' you know how to swing Jiggle up your body, Jiggle up di sinting Unquestionable you a run the sinting Stepping in, 'bout to get it but you ever look hot I'm the queen, boy, you know that you never yet flop Are yoy ready fi a night of loving wid the stamina king? Mi hear you body callin'  Good lord, girl, yuh going so hard (Woo, woo, woo) Girl your legs look the best when I'm spreadin' the two apart (Oh, yeah yeah yeah) Good lord, why you makin' it so hard? Ain't it good enough for you You ready break down my guard (Bing, bing, bing) Love me, love me like that Love me like we ain't never let go (Let go) Love me, love me like that Poco poco, muy, muy lento Take your time and do it just like we were in Jamaica or New York (Bidi, bang, bang, bang) Love me, love me like that Love me, give me some mad love  Watch the tempo, watch the tempo Watch the tempo, watch the tempo Watch the tempo, watch the tempo Love me, give me some mad love (Bidi, bang, bang, bang) Watch the tempo, watch the tempo Watch the tempo, watch the tempo Watch the tempo, watch the tempo Love me, give me some mad love (Woop, woop, woop, woop)|
Avicii |Hey Brother| |Hey brother, there's an endless road to rediscover Hey sister, know the water's sweet but blood is thicker Oh, if the sky comes falling down, for you There's nothing in this world I wouldn't do  Hey brother, do you still believe in one another? Hey sister, do you still believe in love, I wonder? Oh, if the sky comes falling down, for you There's nothing in this world I wouldn't do  What if I'm far from home? Oh brother, I will hear you call What if I lose it all? Oh sister, I will help you out Oh, if the sky comes falling down, for you There's nothing in this world I wouldn't do  Hey brother, there's an endless road to rediscover Hey sister, do you still believe in love, I wonder? Oh, if the sky comes falling down, for you There's nothing in this world I wouldn't do  What if I'm far from home? Oh brother, I will hear you call What if I lose it all? Oh sister, I will help you out Oh, if the sky comes falling down, for you There's nothing in this world I wouldn't do|
|Taylor Swift| Delicate |This ain't for the best My reputation's never been worse, so You must like me for me We can't make Any promises now, can we, babe? But you can make me a drink  Dive bar on the east side, where you at? Phone lights up my nightstand in the black Come here, you can meet me in the back Dark jeans and your Nikes, look at you Oh damn, never seen that color blue Just think of the fun things we could do 'Cause I like you  This ain't for the best My reputation's never been worse, so You must like me for me (Yeah, I want you) We can't make Any promises now, can we, babe? But you can make me a drink  Is it cool that I said all that? Is it chill that you're in my head? 'Cause I know that it's delicate (delicate) Is it cool that I said all that? Is it too soon to do this yet? 'Cause I know that it's delicate  Isn't it? Isn't it? Isn't it? Isn't it? Isn't it? Isn't it? Isn't it? Isn't it delicate?  Third floor on the west side, me and you Handsome, you're a mansion with a view Do the girls back home touch you like I do? Long night with your hands up in my hair Echoes of your footsteps on the stairs Stay here, honey, I don't wanna share 'Cause I like you  This ain't for the best My reputation's never been worse, so You must like me for me (Yeah, I want you) We can't make Any promises now, can we, babe? But you can make me a drink  Is it cool that I said all that? Is it chill that you're in my head? 'Cause I know that it's delicate (delicate) Is it cool that I said all that? Is it too soon to do this yet? 'Cause I know that it's delicate  Isn't it? Isn't it? Isn't it? Isn't it? Isn't it? Isn't it? Isn't it? Isn't it delicate?  Sometimes I wonder when you sleep Are you ever dreaming of me? Sometimes when I look into your eyes I pretend you're mine all the damn time 'Cause I like you  Is it cool that I said all that? Is it chill that you're in my head? 'Cause I know that it's delicate (delicate) (Yeah, I want you) Is it cool that I said all that? Is it too soon to do this yet? 'Cause I know that it's delicate (delicate) 'Cause I like you  Is it cool that I said all that? Isn't it? Isn't it? Is it chill that you're in my head? Isn't it? Isn't it? 'Cause I know that it's delicate Isn't it? (Yeah, I want you)  Is it cool that I said all that? Isn't it? Isn't it? Is it too soon to do this yet? Isn't it? Isn't it? 'Cause I know that it's delicate Isn't it delicate?|
|Justin Timberlake| |Say Something| |Oh, yeah, alright Ooh  Everyone knows all about my direction And in my heart somewhere I wanna go there Still I don't go there  Everybody says "Say something, say something Say something, say something Say something, say something"  I don't wanna get caught up in the rhythm of it But I can't help myself, no, I can't help myself, no, no Caught up in the middle of it No, I can't help myself, no, I can't help myself, no, no, no Caught up in the rhythm of it  Maybe I'm looking for something I can't have (Maybe I'm looking something I can't have) Maybe I'm looking for something I can't have  Everyone knows all about my transgressions Still in my heart somewhere, there's melody and harmony For you and me, tonight (whoa) I hear them call my name  Everybody says "Say something, say something Say something, say something Say something, say something"  I don't want to get caught up in the rhythm of it But I can't get help myself, no I can't help myself, no, no Caught up in the middle of it No I can't help myself, no I can't help myself, no, no, no Caught up in the rhythm of it  Maybe I'm looking for something I can't have (Maybe I'm looking for something I can't have) Maybe I'm looking for something I can't have (Maybe I'm looking for something I can't have) Maybe I'm looking for something I can't have (Maybe I'm looking for something I can't have) Maybe I'm looking for something I can't have (Maybe I'm looking for something I can't have)  Sometimes the greatest way to say something is to say nothing at all Sometimes the greatest way to say something is to say nothing at all Sometimes the greatest way to say something is to say nothing  But I can't help myself, no I can't help myself, no, no Caught up in the middle of it No I can't help myself, no I can't help myself, no, no, no Caught up in the rhythm of it  Maybe I'm looking for something I can't have (Maybe I'm looking for something I can't have) Maybe I'm looking for something I can't have (Maybe I'm looking for something I can't have) Maybe I'm looking for something I can't have (Maybe I'm looking for something I can't have)  Sometimes the greatest way to say something is to say nothing at all Sometimes the greatest way to say something is to say nothing at all Sometimes the greatest way to say something is to say nothing|
Offset |Ric Flair Drip (& Metro Boomin)| |(Bijan 4 The 1 Time) Metro Boomin want some more, nigga! (hey)  Going to the jeweler, bust the AP, yeah (bust it) Slide on the water like a jet-ski, yeah (woo, slide) I'm tryna fuck you and your bestie, yeah (hey) Chopper with the scope so do not test me, (drrt) yeah (drrt) Ric Flair drip, go "woo" on a bitch (woo) Fifty-seven ninety, split the coupe on my wrist (ice) Multi-million dollar, I'm a fool with the hits (ay) Hop up in the Lamb and drop the roof, show the tits (skrt)  Poppin' but you really not gon' shoot (pop) Ninety pointers down my diamonds look like hula hoops (ninety) Hopping in my Bentayga and her seat is a masseuse (hey) Balenciaga, check my posture, Valentino boots (ooh-ooh) It's the Boominati way, a lotta Lambs, a lotta Wraiths (Boominati) Never hesitate to give a nigga yellow tape (grrt) Ain't worried 'bout the bag 'cause the cash accumulatin (bags) Soon as we came in the game, all these niggas they imitate it (hey) Put my mind on it then I put my grind on it (grind) Put the iron on him if a nigga my opponent (iron) My car five-hundred and I don't put no miles on it (hoe) I was runnin' 'round homie, with five-hundred thou' on me (hoe)  Going to the jeweler, bust the AP, yeah (bust it) Slide on the water like a jet-ski, yeah (woo, slide) I'm tryna fuck you and your bestie, yeah (hey) Chopper with the scope so do not test me, (drrt) yeah (drrt) Ric Flair drip, go "woo" on a bitch (woo) Fifty-seven ninety, split the coupe on my wrist (ice) Multi-million dollar, I'm a fool with the hits (ay) Hop up in the Lamb and drop the roof, show the tits (Offset)  Twist my fingers, got the gang with me (gang with me) Bought my first Patek, it got some rain on it (Patek) Nigga, we used to kick it, how you hatin' on me? (ha-ha) Hop in the Bentley coupe and blow the brains out it (skrrt!) We not the same, my nigga My nigga, we from the north division (north, nawf) Amateur brain, yeah we bought ya just like it's an auction, ain't it (hey) Beat the chopper, hundred round total, like it's car collision (brrt-brrt) I made that shit mandatory, that means I had to get it (hey) My shooter keep begging "please", he ready to wack a nigga (please, please) I gave a nigga a diamond, I had to cap a nigga (woo) I'm giving your hoe away like she a raffle, nigga (here, here) We get at it, then we 'gone pray with the pastor's scriptures (hey)  Going to the jeweler, bust the AP, yeah (bust it) Slide on the water like a jet-ski, yeah (woo, slide) I'm tryna fuck you and your bestie, yeah (hey) Chopper with the scope so do not test me, (drrt) yeah (drrt) Ric Flair drip, go "woo" on a bitch (woo) Fifty-seven ninety split the coupe on my wrist (ice) Multi-million dollar, I'm a fool with the hits (ay) Hop up in the Lamb and drop the roof, show the tits (skrt) Going to the jeweler, bust the AP, yeah (bust it) Slide on the water like a jet-ski, yeah (woo, slide) I'm tryna fuck you and your bestie, yeah (hey) Chopper with the scope so do not test me, (drrt) yeah (drrt) Ric Flair drip, go "woo" on a bitch (woo) Fifty-seven ninety, split the coupe on my wrist (ice) Multi-million dollar, I'm a fool with the hits (ay) Hop up in the Lamb and drop the roof, show the tits (skrt)|
|Dua Lipa| |New Rules| |(One, one, one)  Talkin' in my sleep at night, makin' myself crazy (Out of my mind, out of my mind) Wrote it down and read it out, hopin' it would save me (Too many times, too many times)  My love, he makes me feel like nobody else, nobody else But my love, he doesn't love me, so I tell myself, I tell myself  One, don't pick up the phone You know he's only calling 'cause he's drunk and alone Two, don't let him in You'll have to kick him out again  Three, don't be his friend You know you're gonna wake up in his bed in the mornin' And if you're under him You ain't gettin' over him  I got new rules, I count 'em I got new rules, I count 'em I gotta tell them to myself I got new rules, I count 'em I gotta tell them to myself  I keep pushin' forwards but he keeps pullin' me backwards (Nowhere to turn, no way, nowhere to turn, no) Now I'm standin' back from it, I finally see the pattern (I never learn, I never learn)  But my love, he doesn't love me, so I tell myself, I tell myself I do, I do, I do  One, don't pick up the phone You know he's only calling 'cause he's drunk and alone Two, don't let him in You'll have to kick him out again  Three, don't be his friend You know you're gonna wake up in his bed in the mornin' And if you're under him You ain't gettin' over him  I got new rules, I count 'em I got new rules, I count 'em I gotta tell them to myself I got new rules, I count 'em I gotta tell them to myself  Practice makes perfect, I'm still tryna learn it by heart (I got new rules, I count 'em) Eat, sleep and breathe it, rehearse and repeat it 'cause I (I got new, I got new, I got new)  One, don't pick up the phone You know he's only calling 'cause he's drunk and alone Two, don't let him in You'll have to kick him out again  Three, don't be his friend You know you're gonna wake up in his bed in the mornin' And if you're under him You ain't gettin' over him  I've got new rules, I count 'em I've got new rules, I count 'em I've gotta tell them to myself I've got new rules, I count 'em (Baby, you know I count 'em) I've gotta tell them to myself  Don't let him in, don't let him in (Don't, don't, don't, don't) Don't be his friend, don't be his friend (Don't, don't, don't, don't) Don't let him in, don't let him in (Don't, don't, don't, don't) Don't be his friend, don't be his friend (Don't, don't, don't, don't)  You're gettin' over him|
|J. Cole| |FRIENDS (feat. kiLL edward)| |J. Cole Cop another bag of smoke today Cop another bag of smoke today Cop another bag of smoke today Cop another bag of smoke today Cop another bag of smoke today Cop another bag of smoke today Cop another bag of smoke today Cop another bag of smoke today  KiLL edward I got thoughts, can't control Got me down, got me low Rest my mind, rest my soul When I blow, when I blow Am I wrong, let them know Feels so right to let things go Don't think twice, this is me This is how I should be  J. Cole But I'm aggravated without it My saddest days are without it My Saturdays are the loudest I'm blowing strong Some niggas graduated with powder I dabble later, I doubt it My database of narcotics It's growing long But I'm aggravated without it My saddest days are without it My Saturdays are the loudest I'm blowing strong Some niggas graduated with powder I dabble later, I doubt it My database of narcotics It's growing long  I wrote this shit to talk about the word addiction To my nigga --- I hope you listening --- I hope you listening This is for the whole fucking 'ville I hope you're listening Smoking medical grade, but I ain't got perscription All the way in Cali where they ain't got precipi- -Tation, feeling like the only one that made it And I hate it for my niggas 'cause they ain't got ambition Fuck did you expect, you can blame it on condition Blame it on crack, you can blame it on the system Blame it on the fact that 12 got jurisdiction To ride around in neighborhoods that they ain't ever lived in Blame it on the strain that you feel when daddy missing Blame it on Trump shit, blame it on Clinton Blame it on trap music and the politicians Or the fact that every black boy wanna be Pippen But they only got twelve slots on the Pistons Blame it on the rain, Milli Vanilli with the disk skip What I'm tryna say is the blame can go deep as seas Just to blame 'em all I would need like twenty CD's There's all sorts of trauma from drama that children see Type of shit that normally would call for therapy But you know just how it go in our community Keep that shit inside it don't matter how hard it be Fast forward, them kids is grown and they blowing trees And popping pills due to chronic anxiety I been saw the problem but stay silent 'cause I ain't Jesus This ain't no trial if you desire go higher please But fuck that now I'm older I love you 'cause you my friend Without the drugs I want you be comfortable in your skin I know you so I know you still keep a lot of shit in You running from yourself and you buying product again I know you say it helps and no I'm not trying to offend But I know depression and drug addiction don't blend Reality distorts and then you get lost in the wind And I done seen the combo take niggas off the deep end One thing about your demons they bound to catch up one day I'd rather see you stand up and face them than run away I understand this message is not the coolest to say But if you down to try it I know of a better way Meditate  Meditate, meditate, meditate, meditate Don't medicate, medicate, don't medicate, medicate Meditate, meditate, meditate, meditate Don't medicate, medicate, don't medicate, medicate  KiLL edward I got thoughts, can't control Got me down, got me low Rest my mind, rest my soul When I blow, when I blow Am I wrong, let them know Feels so right to let things go Don't think twice, this is me This is how I should be  J. Cole Cop another bag of smoke today Cop another bag of smoke today Cop another bag of smoke today Cop another bag of smoke today Cop another bag of smoke today Cop another bag of smoke today Cop another bag of smoke today Cop another bag of smoke today|
