|Cardi B| |Bodak Yellow| |KSR (ooh) Hah, it's Cardi, ay Said, "I'm the shit, wanna fuck with me if they wanted to" Umm damn  Said, "Lil bitch, you can't fuck with me if you wanted to" (ooh) These expensive, these is red bottoms, these is bloody shoes (ooh) Hit the store, I can get 'em both, I don't wanna choose (bah) And I'm quick, cut a nigga off, so don't get comfortable, look (ooh)  I don't dance now, I make money moves (wave, ay) Say I don't gotta dance, I make money move (ooh, ooh) If I see you and I don't speak, that means I don't fuck with you (ah) I'm a boss, you a worker, bitch, I make bloody moves (bags)  Now she say she gon' do what to who? Let's find out and see Cardi B, you know where I'm at, you know where I be (ooh, ooh) You in the club just to party, I'm there, I get paid a fee (bah) I be in and out them banks so much I know they're tired of me (ooh) Honestly, don't give a fuck 'bout who ain't fond of me (who) Dropped two mixtapes in six months What bitch working as hard as me? (ooh) I don't bother with these hoes Don't let these hoes bother me (yeah) They see pictures, they say, "Goals" Bitch, I'm who they tryna be (blah) Look, I might just chill in some BAPE (ooh) I might just chill with your boo I might just feel on your babe, my pussy feel like a lake He wanna swim with his face, I'm like, "Okay" (okay) I'll let him did what he want, he buy me Yves Saint Laurent (yeah) And the new whip, when I go fast as a horse I got the trunk in the front (vroom) I'm the hottest in the street, know you prolly heard of me Got a bag and fixed my teeth, hope you hoes know it ain't cheap And I pay my mama bills, I ain't got no time to chill Think these hoes be mad at me, their baby father want a feel (ooh)  Said, "Lil bitch, you can't fuck with me if you wanted to" (ooh) These expensive, these is red bottoms, these is bloody shoes (ooh) Hit the store, I can get 'em both, I don't wanna choose (bah) And I'm quick, cut a nigga off, so don't get comfortable, look (ooh)  I don't dance now, I make money moves (wave, ay) Say I don't gotta dance, I make money move (ooh, ooh) If I see you and I don't speak, that means I don't fuck with you (ah) I'm a boss, you a worker, bitch, I make bloody moves (bags, bags)  If you a pussy, you get popped (popped, popped) You a groupie, you a opp (opp, blah) Don't you come around my way (yeah) You can't hang around my block (nope) And I just checked my accounts Turns out, I'm rich, I'm rich, I'm rich (I'm rich) I put my hand above my hip, I bet you dip, he dip, she dip (grrrah) I say I get the money and go (yeah) This shit is hot like a stove (ooh) My pussy glitter as gold, tell that lil bitch play her role (ah, ah) I just a-rove in a Rolls (oh) I just came up in a Wraith (yeah) I need to fill up the tank, no, I need to fill up the safe (ooh) I need to let all these hoes know that none of their niggas is safe I go to dinner and steak (blah, yeah) Only the real can relate (yeah) I used to live in the P's (ooh, ooh) Now it's a crib with a gate (ah) Rollie got charms, look like Frosted Flakes (bling) I had to let these bitches know (yeah) Just in case these hoes forgot (oh) I just run and check the mail, another check from Mona Scott (oh)  Said, "Lil bitch, you can't fuck with me if you wanted to" (ooh) These expensive, these is red bottoms, these is bloody shoes (ooh) Hit the store, I can get 'em both, I don't wanna choose (bah) And I'm quick, cut a nigga off, so don't get comfortable, look (ooh)  I don't dance now, I make money moves (wave, ay) Say I don't gotta dance, I make money move (ooh, ooh) If I see you and I don't speak, that means I don't fuck with you (ah) I'm a boss, you a worker, bitch, I make bloody moves (bags)|
|J. Cole| Intro |Yeah Still at it Villmatic, What a life we chose I'm sending this out to those Who fell down, but then rose I'm hot, I'm hell bound with these flows, Cole, And when my story's told Let it be known that I'd never fold I took my time I gave my soul I watched you shine But me I glow, so I'm coming for what I'm owed Ya know|
|Jax Jones| Breathe |Dum-dum-da-da-da-dum, dum-dum-da-da-da Dum-dum-da-da-da-dum, dum-dum-da-da-da Dum-dum-da-da-da-dum, dum-dum What you, what you gonna do? Oh oh Hmmm yeah ah You're my discretional sin I feel you on me when I touch my skin You got me hooked and you ain't let me in And I look in your eyes, I'm on the edge  You're on my mind like a song that I can't escape I don't know how many da-da-dums I can take I need to know if you're feeling, feeling the same Is it too late?  But now it's hard to breathe I'm not in love, it's just a game we do I tell myself I'm not that into you But I don't wanna sleep, it's quarter after 3  You're in my head like Dum-dum-da-da-da-dum, dum-dum-da-da-da Dum-dum-da-da-da-dum, dum-dum-da-da-da You're in my head like Dum-dum-da-da-da-dum, dum-dum-da-da-da Dum-dum-da-da-da-dum, dum-dum-da-da-da  You're my obsession, my truth I call my lifeline whenever I'm with you And now I dialed your number again And you come over and over, and then  You're on my mind like a song that I can't escape I don't know how many da-da-dums I can take I need to know if you're feeling, feeling the same Is it too late?  But now it's hard to breathe I'm not in love, it's just a game we do I tell myself I'm not that into you But I don't wanna sleep, it's quarter after 3 And now it's hard to breathe I'm not in love, it's just a thing we make We're skin on skin, I need this spell to break But I don't wanna go and I know that you know  You're in my head like Dum-dum-da-da-da-dum, dum-dum-da-da-da Dum-dum-da-da-da-dum, dum-dum-da-da-da You're in my head like Dum-dum-da-da-da-dum, dum-dum-da-da-da Dum-dum-da-da-da-dum  And now it's hard to breathe (thing we make) Breathe (into you) Breathe (thing we make) Breathe And now it's hard to breathe (thing we make) Breathe (into you) Breathe (thing we make)  I know it's hard to breathe I'm not in love, it's just a game we do I tell myself I'm not that into you But I don't wanna sleep, it's quarter after 3 I know it's hard to breathe I'm not in love, it's just a thing we make We're skin on skin, I need this spell to break But I don't wanna go and I know that you know  You're in my head like Dum-dum-da-da-da-dum, dum-dum-da-da-da Dum-dum-da-da-da-dum, dum-dum-da-da-da Dum-dum-da-da-da-dum, dum-dum-da-da-da Dum-dum-da-da-da-dum, dum-dum-da-da-da|
Bazzi Beautiful |Hey Beautiful beautiful beautiful beautiful angel Know your imperfections every angle Tomorrow comes and goes before you know, so I just had to let you know The way that Gucci look on you amazing But nothing can compare to when you're naked Now a backward into many got you faded  Saying you don't want from me I need to face it  Started when we were younger Swear to god that I loved her Sorry that your mum found out Guess that we just had the fun though  Anybody asked I'd be under Ain't nobody else that I'd be under Beautiful beautiful life right now Beautiful beautiful night right now No no nono  Hey Beautiful beautiful beautiful beautiful angel Know your imperfections every angle Tomorrow comes and goes before you know, so I just had to let you know The way that dress fall off you is amazing Loving me we are a beautiful creation Baby come a little closer let me taste it You came a little closer now you're shaking  Never ever gonna mislead you, don't believe the lies they feed you Stop and stare like a sculpture Baby you look harmless Beautiful beautiful life right now Beautiful beautiful night right now Beautiful beautiful by my side right now  Hey Beautiful beautiful beautiful beautiful angel Know your imperfections every angle Tomorrow comes and goes before you know, I just have to let you know The way that Gucci look on you amazing Nothing can compare to when you're naked Tomorrow comes and goes before you know I just had to let you know I just had to let you know Swear to god your beautiful (yeah)|
Khalid |Young Dumb & Broke| |So you're still thinking of me Just like I know you should I can not give you everything, you know I wish I could I'm so high at the moment I'm so caught up in this Yeah, we're just young, dumb and broke But we still got love to give  While we're young dumb Young, young dumb and broke Young dumb Young, young dumb and broke Young dumb Young dumb Young, young dumb and broke Young dumb broke high school kids Yadadadadadadada Yadadadadadada Yadadadadadadada Young dumb broke high school kids  We have so much in common We argue all the time You always say I'm wrong I'm pretty sure I'm right What's fun about commitment? When we have our life to live Yeah, we're just young dumb and broke But we still got love to give  While we're young dumb Young, young dumb and broke Young dumb Young, young dumb and broke Young dumb Young, young dumb and broke Young dumb broke high school kids Yadadadadadadada Yadadadadadada Yadadadadadadada Young dumb broke high school kids  Jump and we think - do it all in the name of love Love Run into sin, do it all in the name of fun Fun Whoa-oa-oa I'm so high at the moment I'm so caught up in this Yeah, we're just young, dumb and broke But we still got love to give  While we're young dumb Young, young dumb and broke Young dumb Young, young dumb and broke Young dumb Young dumb Young, young dumb and broke Young dumb broke high school kids Yadadadadadadada Yadadadadadada Yadadadadadadada Young dumb broke high school kids|
XXXTENTACION changes |Mmm, baby I don't understand this You're changing, I can't stand it My heart can't take this damage And the way I feel, can't stand it Mmm, baby I don't understand this You're changing, I can't stand it My heart can't take this damage And the way I feel, can't stand it Mmm, baby I don't understand it  Girl, you're making it hard for me Girl, you're making it hard for me Girl, you're making it hard for me, uh Girl, you're making it hard for me Girl, you're making it hard for me Girl, you're making it hard for me  Mmm, baby I don't understand this You're changing, I can't stand it My heart can't take this damage And the way I feel, can't stand it Mmm, baby I don't understand this You're changing, I can't stand it My heart can't take this damage And the way I feel, can't stand it Mmm, baby I don't understand this You're changing, I can't stand it My heart can't take this damage And the way I feel, can't stand it Mmm, baby I don't understand it|
|Clean Bandit| |I Miss You (feat. Julia Michaels)| |I know you're out in Cabo Hanging with your brother Wishin' that I was your bottle So I could be close to your lips again I know you didn't call your parents And tell 'em that we ended 'Cause you know that they'd be offended Did you not want to tell 'em it's the end  And I know we're not supposed to talk But I'm getting ahead of myself I get scared when you're not 'Cause I'm scared you're with somebody else I guess that it is gone And I just keep lying to myself I can't believe it  I miss you, yeah I miss you I miss you, yeah I miss you, oh I do I miss you, yeah I miss you Though I'm tryin' not to right now  You weren't a fan of pictures So I hardly ever took 'em Got them saved in my mind from the bedroom So that way I can't forget your skin So I saved all the texts All of the best over the years Just to remind myself Of how good it is Or was  And I know we're not supposed to talk But I'm getting ahead of myself I get scared when you're not 'Cause I'm scared you're with somebody else I guess that it is gone And I just keep lying to myself I can't believe it  I miss you, yeah I miss you I miss you, yeah I miss you, oh I do I miss you, yeah I miss you Though I'm tryin' not to right now  So I saved all the texts All of the best over the years Just to remind myself Of how good it is Yeah, I saved all the texts off of my ex Minus the tears Just to remind myself Of how good it is Or was 'Cause I...  I miss you, yeah I miss you I miss you, yeah I miss you, oh I do I miss you, yeah I miss you Though I'm tryin' not to right now I can't help it, I just- Though I'm tryin' not to right now I can't help it, I just-|
|Cardi B| |Bartier Cardi (feat. 21 Savage)| |Bardi in a 'Rari, diamonds all over my body Shinin' all over my body Put that bitch on Molly Bardi Bitch on Molly 21, diamonds all over my body Said, that bitch on Molly Nigga, I'm 'bout it  Your bitch wanna party with Cardi Cartier Bardi in a 'Rari (21) Diamonds all over my body (Cardi) Shinin' all over my body (my body) Cardi got your bitch on molly Bitch, you ain't gang, you lame Bentley truck lane to lane Blow out the brain (21) I go insane, insane I drop a check on the chain Fuck up a check in the plane Cardi took your man, you upset, uh Cardi got rich, they upset, yeah (from what?) Cardi put the pussy on Offset (say what?) Cartier, Cardi B brain on Offset (21) Cardi took your man, you upset, uh Cardi got rich, they upset, yeah (21) Cardi put the pussy on Offset (Cardi) Cartier, Cardi B brain on Offset (Cardi)  Who get this motherfucker started? (Cardi) Who took your bitch out to party? (Cardi) I took your bitch in the party (Cardi) Who that be fly as a Martian? (Cardi) Who that on fleek in the cut? (Cardi) Who got the bricks in the truck? (Cardi) Them diamonds gon' hit like a bitch on a bitchy ass bitch Bitch, you a wannabe Cardi Red bottom M.J., moonwalk on a bitch Moonwalkin' through your clique I'm moonwalkin' in the 6 Sticky with the kick, moonrocks in this bitch I'm from the motherfuckin' Bronx (Bronx) I keep the pump in the trunk (trunk) Bitch if you bad then jump (jump) Might lead your bitch in a slump (your back)  Your bitch wanna party with Cardi Cartier Bardi in a 'Rari (21) Diamonds all over my body (Cardi) Shinin' all over my body (my body) Cardi got your bitch on molly Bitch, you ain't gang, you lame Bentley truck lane to lane Blow out the brain (21) I go insane, insane I drop a check on the chain Fuck up a check in the plane Cardi took your man, you upset, uh Cardi got rich, they upset, yeah (from what?) Cardi put the pussy on Offset (say what?) Cartier, Cardi B brain on Offset (21) Cardi took your man, you upset, uh Cardi got rich, they upset, yeah (21) Cardi put the pussy on Offset (Cardi) Cartier, Cardi B brain on Offset (Cardi)  Your bitch wanna party with a Savage (21) Saint Laurent Savage in an Aston (yeah) High end cars and fashion (21) I don't eat pussy, I'm fastin' (on God) I'm a Blood, my brother Crippin' Bitch, I'm drippin', ho, you trippin' Told the waitress I ain't tippin' I like hot sauce on my chicken (on God) I pulled the rubber off and I put hot sauce on her titties (21) I'm in a Bentley truck, she keep on suckin' like it's tinted (21) All these VVS', nigga, my sperm worth millions (on God) The bitch so bad I popped a Molly 'fore I hit it (21, 21)  Your bitch wanna party with Cardi Cartier Bardi in a 'Rari (21) Diamonds all over my body (Cardi) Shinin' all over my body (my body) Cardi got your bitch on molly Bitch, you ain't gang, you lame Bentley truck lane to lane Blow out the brain (21) I go insane, insane I drop a check on the chain Fuck up a check in the plane Cardi took your man, you upset, uh Cardi got rich, they upset, yeah (from what?) Cardi put the pussy on Offset (say what?) Cartier, Cardi B brain on Offset (21) Cardi took your man, you upset, uh Cardi got rich, they upset, yeah (21) Cardi put the pussy on Offset (Cardi) Cartier, Cardi B brain on Offset (Cardi)  Step in this bitch in Givenchy (cash) Fuck up a check in Givenchy (cash) Boss out the coupe and them inches I fuck up a bag at the Fendi, I fuck up a bag in a minute Who you know drip like this? Who you know built like this? I'm poppin' shit like a dude Pull up to pop at your crew Brr, poppin' at you (woo) They say you basic I flooded the Rollie with diamonds I flooded the Patek and bracelet I got your bitch and she naked Ice on the cake when I bake it I'm switchin' lanes in the Range Swap out the dick for the brain Swap out your bitch for your main Swap out the trap for the fame Ice on them, Carti B Cartier frames  Your bitch wanna party with Cardi Cartier Bardi in a 'Rari (21) Diamonds all over my body (Cardi) Shinin' all over my body (my body) Cardi got your bitch on molly Bitch, you ain't gang, you lame Bentley truck lane to lane Blow out the brain (21) I go insane, insane I drop a check on the chain Fuck up a check in the plane Cardi took your man, you upset, uh Cardi got rich, they upset, yeah (from what?) Cardi put the pussy on Offset (say what?) Cartier, Cardi B brain on Offset (21) Cardi took your man, you upset, uh Cardi got rich, they upset, yeah (21) Cardi put the pussy on Offset (Cardi) Cartier, Cardi B brain on Offset (Cardi)|
|French Montana| Unforgettable |It's not good enough for me, since I been with you It's not gonna work for you, nobody can equal me, I know  I'm gonna sip on this drink, when I'm fucked up I should know how to pick up I'm gonna catch the rhythm while she push up against me Ooh, is she tipsy? I had enough convo for 24 I peep'd you from across the room Pretty little body, dancing like GoGo  But you are unforgettable I need to get you alone, why not? A fucking good time, never hurt nobody I got a little drink but it's not Bacardi If you loved your girl then I'm so, so sorry I got to give it to her like we in a marriage Oh, like we in a hurry No, no I won't tell nobody You're on your level too Tryna do what lovers do  Feelin' like I'm fresh out; Boosie If they want the drama, got the Uzi Ship the whole crew to the cruise ship Doin' shit you don't even see in movies Ride with me, ride with me, boss I got a hard head but her ass soft She want the last name with the ring on it 'Cause I pulled out a million cash, told her plank on it  You are unforgettable I need to get you alone Now you wanna choose Just pop the bubbly in the 'cuzi  It's not good enough for me, since I been with you It's not gonna work for you, nobody can equal me, I know  I'm gonna sip on this drink, when I'm fucked up I should know how to pick up I'm gonna catch the rhythm while she push up against me Ooh, is she tipsy? I had enough convo for 24 I peep'd you from across the room Pretty little body, dancing like GoGo  But you are unforgettable I need to get you alone Why not? A fucking good time, never hurt nobody I got a little drink but it's not gonna party If you loved your girl then I'm so, so sorry I got to give it to her like we in a marriage Oh, like we in a hurry No, no I won't tell nobody You're on your level too Tryna do what lovers do  You ain't enough for me Too much for you alone Baby go and grab some bad bitches Bring 'em home  Know the jet's on me I'ma curve my best for you You don't know, so pick up that dress for me Leave the rest on  Too much convo 24 hours When you stand next to 24 karats She left her man at home She don't love him no more  I want your mind and your body Don't mind nobody So as long you never hurt nobody Baby girl work your body Work your body  You are unforgettable I need to get you alone Now you wanna choose Just pop the bubbly in the 'cuzi  Why not?  Oh, like we in a hurry No, no I won't tell nobody You're on your level too Tryna do what lovers do|
|Maroon 5| |What Lovers Do (feat. SZA)| |Say say say, hey hey now baby Oh mama, don't play now baby Say say say, hey hey now baby Said let's get one thing straight now baby Tell me tell me if you love me or not, love me or not, love me or not I'll bet the house on you, am I lucky or not, lucky or not, lucky or not? You gotta tell me if you love me or not, love me or not, love me or not Been wishin' for you, am I lucky or not, lucky or not, lucky or not?  Ooh, ooh Been wishin' for you Ooh, ooh Trying to do what lovers do (ooh) Ooh, ooh Been wishin' for you Ooh, ooh Trying to do what lovers do (ooh)  Say say say, hey hey now baby You gon' make me hit you with that lay down, baby (oh) Say say say, hey hey now baby You know what I need, out the gate now baby  Tell me, tell me if you love me or not, love me or not, love me or not I'll bet the house on you, am I lucky or not, lucky or not, lucky or not? You gotta tell me if you love me or not, love me or not, love me or not Been wishin' for you am I lucky or not, lucky or not, lucky or not?  Ooh, ooh Been wishin' for you Ooh, ooh Trying to do what lovers do (ooh) Ooh, ooh Been wishin' for you Ooh, ooh Trying to do what lovers do (ooh) What lovers do What lovers do What lovers do  Aren't we too grown for games? Aren't we too grown to play around? Young enough to chase But old enough to know better Aren't we too grown for changin'? Aren't we too grown to mess around? Ooh and I can't wait forever baby Both of us should know better  Ooh, ooh Been wishin' for you Ooh, ooh Trying to do what lovers do (ooh) Ooh, ooh Been wishin' for you Ooh, ooh Trying to do what lovers do (ooh) Ooh, ooh Been wishin' for you Ooh, ooh Trying to do what lovers do (ooh) Ooh, ooh Been wishin' for you Ooh, ooh Trying to do what lovers do (ooh)|
|The Weeknd| |Try Me| |Any time is the time Any time for you to get my call, baby (so, baby) Are you alone, baby? Babe, he ain't around, pick up your phone, baby Whoa  Can you try me? (try me), try me (try me) Once you put your pride aside You can notify me (fy me), -fy me (fy me) You're the best I ever had Baby girl, remind me (mind me), -mind me (mind me) Lemme know if it's on And you know where to find me, find me Having thoughts you never had, yeah  I didn't know you were down for him finding out I thought you had some kind of love for your man Well, I'm not tryna break up something You've been workin' out, you've been steady But I'm ready to go all the way if you let me Don't you tempt me  You're lookin' grown since the last time I looked at you It might have been, been about a couple months But I just got the picture that you texted to me You ain't steady, you look ready to go all the way If you let me take you down on me  Can you try me? (try me), try me (try me) Once you put your pride aside (once you put your pride aside) You can notify me (fy me), -fy me (fy me) You're the best I ever had (you're the best I ever had) Baby girl, remind me (mind me), -mind me (mind me) Let me know if it's on (let me know) And you know where to find me, find me Havin' thoughts you never had, yeah Can you try me? Try me, try me Once you put your pride aside You can notify me, -fy me You're the best I ever had Baby girl, remind me, -mind me Lemme know if it's on (let me know, baby) And you know where to find me (find me), find me (find me) Having thoughts you never had, yeah  Oh, lo Lo-lo-lo-lo-lo-lo Lo-lo-lo-lo-lo, lo-lo-lo Lo-lo-lo-lo-lo-lo Better try me  Don't you mess with me Don't you mess with me The way I kissed your scars The way I fixed your heart Don't you mess with me, babe Don't you mess with me|
