|Cardi B| |I Do (feat. SZA)| |I left a nigga on read 'cause I felt like it Dress me down in that Raf, Saint Laurent jacket Dapper, dapper, I look fine and my checks divine No wonder, wonder why I do whatever I like I do what I like, I do, I do I do what I like, I do, I do I do what I like, I do, I do I do what I like, I do, I do  I think us bad bitches is a gift from God (gift from God) I think you broke hoes need to get a job (get a job) Now I'm a boss, I write my own name on the checks (Cardi) Pussy so good, I say my own name during sex I might smack a bitch 'cause I felt like it Gucci shoes and a belt like it Said that Cardi is his favorite fragrance I'm a rich bitch and I smell like it I'm in a boss bitch mood, ay, these heels are Givenchy, ho These are some boss bitch shoes, if you ain't no boss bitch, move, ay For the record, I set records, record sales I like niggas that been in and outta jail They said by now that I'll be finished, hard to tell (I can tell) My little 15 minutes lasting long as hell, huh?  I left a nigga on read 'cause I felt like it Dress me down in that Raf, Saint Laurent jacket Dapper, dapper, I look fine and my checks divine No wonder, wonder why I do whatever I like I do what I like, I do, I do I do what I like, I do, I do I do what I like, I do, I do I do what I like, I do, I do  Look, broke hoes do what they can (can) Good girls do what they told (told) Bad bitches do what they want (they want) That's why a bitch is so cold I'm a gangsta in a dress, I'm a bully in the bed Only time that I'm a lady's when I lay these hoes to rest The coupe is roofless, but I get top in it I'm provocative, it's my prerogative 80K just to know what time is it Cardi rockin' it, go buy stock in it Spent what I want, ain't no limit I say what I want, I ain't never been timid Only real shit comes out my mouth and only real niggas go in it Leave his texts on read, leave his balls on blue Put it on airplane mode so none of those calls come through Here's a word to my ladies, don't you give these niggas none (give 'em none) If they can't make you richer, they can't make you cum  I left a nigga on read 'cause I felt like it Dress me down in that Raf, Saint Laurent jacket Dapper, dapper, I look fine, and my checks divine No wonder wonder why I do whatever I like I do what I like, I do, I do I do what I like, I do, I do I do what I like, I do, I do I do what I like, I do, I do|
|Demi Lovato| |Sorry Not Sorry| |Payback is a bad bitch And baby, I'm the baddest (I'm the baddest, I'm the baddest)  Now I'm out here looking like revenge Feelin' like a ten, the best I've ever been And yeah I know, how bad it must hurt To see me like this, but it gets worse (wait a minute) Now you're out here looking like regret Ain't too proud to beg, second chance you'll never get And yeah I know, how bad it must hurt to see me like this But it gets worse (wait a minute)  Now payback is a bad bitch And baby, I'm the baddest You fuckin' with a savage Can't have this, can't have this (ah) And it'd be nice of me to take it easy on ya, but nah  Baby, I'm sorry (I'm not sorry) Baby, I'm sorry (I'm not sorry) Being so bad got me feelin' so good Showing you up like I knew that I would Baby, I'm sorry (I'm not sorry) Baby, I'm sorry (I'm not sorry) Feeling inspired 'cause the tables have turned Yeah, I'm on fire and I know that it burns  Baby, fineness is the way to kill Tell me how it feel, bet it's such a bitter pill And yeah I know, you thought you had bigger, better things Bet right now this stings (wait a minute) 'Cause the grass is greener under me Bright as Technicolor, I can tell that you can see And yeah I know, how bad it must hurt to see me like this But it gets worse (wait a minute)  Now payback is a bad bitch And baby, I'm the baddest You fuckin' with a savage Can't have this, can't have this (ah) And it'd be nice of me to take it easy on ya, but nah  Baby, I'm sorry (I'm not sorry) Baby, I'm sorry (I'm not sorry) Being so bad got me feelin' so good Showing you up like I knew that I would Baby, I'm sorry (I'm not sorry) Baby, I'm sorry (I'm not sorry) Feeling inspired 'cause the tables have turned Yeah, I'm on fire and I know that it burns  Talk that talk, baby Better walk, better walk that walk, baby If you talk, if you talk that talk, baby Better walk, better walk that walk, baby Oh yeah, talk that talk, baby Better walk, better walk, that walk, baby If you talk, if you talk that talk, baby Better walk, better walk that walk, baby  Baby, I'm sorry (I'm not sorry) Baby, I'm sorry (I'm not sorry) Being so bad got me feelin' so good Showing you up like I knew that I would Baby, I'm sorry (I'm not sorry) Baby, I'm sorry (I'm not sorry) Feeling inspired 'cause the tables have turned Yeah, I'm on fire and I know that it burns  Payback is a bad bitch And baby, I'm the baddest I'm the baddest, I'm the baddest|
|Calum Scott| |You Are The Reason| |There goes my heart beating 'Cause you are the reason I'm losing my sleep Please come back now  There goes my mind racing And you are the reason That I'm still breathing I'm hopeless now  I'd climb every mountain And swim every ocean Just to be with you And fix what I've broken Oh, 'cause I need you to see That you are the reason  There goes my hands shaking And you are the reason My heart keeps bleeding I need you now  If I could turn back the clock I'd make sure the light defeated the dark I'd spend every hour, of every day Keeping you safe  And I'd climb every mountain And swim every ocean Just to be with you And fix what I've broken Oh, 'cause I need you to see That you are the reason You are the reason  I'm a little sad Just a little sad I'm a little sad I need you to hold me tonight  I'd climb every mountain And swim every ocean Just to be with you And fix what I've broken 'Cause I need you to see That you are the reason|
|Imagine Dragons| |Whatever It Takes| |Falling too fast to prepare for this Tripping in the world could be dangerous Everybody circling is vulturous Negative, Nepotist  Everybody waiting for the fall of man Everybody praying for the end of times Everybody hoping they could be the one I was born to run, I was born for this  Whip, whip Run me like a race horse Hold me like a rip cord Break me down and build me up I wanna be the slip, slip Word upon your lip, lip Letter that you rip, rip Break me down and build me up  Whatever it takes 'Cause I love the adrenaline in my veins I do whatever it takes 'Cause I love how it feels when I break the chains Whatever it takes Ya take me to the top, I'm ready for Whatever it takes 'Cause I love the adrenaline in my veins I do what it takes  Always had a fear of being typical Looking at my body feeling miserable Always hanging on to the visual I wanna be invisible  Looking at my years like a martyrdom Everybody needs to be a part of 'em Never be enough from the particle sum I was born to run, I was born for this  Whip, whip Run me like a race horse Hold me like a rip cord Break me down and build me up I wanna be the slip, slip Word upon your lip, lip Letter that you rip, rip Break me down and build me up  Whatever it takes 'Cause I love the adrenaline in my veins I do whatever it takes 'Cause I love how it feels when I break the chains Whatever it takes Ya take me to the top, I'm ready for Whatever it takes 'Cause I love the adrenaline in my veins I do what it takes  Hypocritical, egotistical Don't wanna be the parenthetical Hypothetical, working onto something that I'm proud of Out of the box an epoxy to the world and the vision we've lost I'm an apostrophe, I'm just a symbol to reminds you that there's more to see I'm just a product of the system, a catastrophe And yet a masterpiece, and yet I'm half diseased And when I am deceased At least I go down to the grave and I happily Leave the body of my soul to be a part of me I do what it takes  Whatever it takes 'Cause I love the adrenaline in my veins I do whatever it takes 'Cause I love how it feels when I break the chains Whatever it takes Ya take me to the top, I'm ready for Whatever it takes 'Cause I love the adrenaline in my veins I do what it takes|
|Travis Scott| goosebumps |Yeah 7:30 in the night Ooh ooh  I get those goosebumps every time, yeah, you come around, yeah You ease my mind, you make everything feel fine Worry about those comments I'm way too numb, yeah, it's way too dumb, yeah I get those goosebumps every time, I need the Heimlich Throw that to the side, yeah I get those goosebumps every time, yeah, when you're not around When you throw that to the side, yeah I get those goosebumps every time, yeah  7-1-3 to the 2-8-1, yeah I'm riding Why they on me? Why they on me? I'm flyin' Sippin' lowkey I'm sipping lowkey in Onyx Rider, rider when I'm pullin' up right beside ya Popstar, lil' Mariah When I text a cute game, wildness Throw a stack on the Bible Never Snapchat or took molly She fall through plenty, her and all her ginnies Yeah, we at the top floor, right there off Doheny Oh no, I can't fuck with y'all Yeah, when I'm with my squad I cannot do no wrong Yeah, saucing in the city, don't get misinformed, yeah They gon' pull up on you (brr, brr, brr) Yeah, we gon' do some things, some things you can't relate Yeah, 'cause we from a place, a place you cannot stay Oh, you can't go, oh, I don't know Oh, back the fuck up off me (brr, brr, brr)  I get those goosebumps every time, yeah, you come around, yeah You ease my mind, you make everything feel fine Worry about those comments I'm way too numb, yeah, it's way too dumb, yeah I get those goosebumps every time, I need the Heimlich Throw that to the side, yeah I get those goosebumps every time, yeah, when you're not around When you throw that to the side, yeah I get those goosebumps every time  I want to press my like, yeah, I wanna press my I want a green light, I wanna be like I wanna press my line, yeah I want to take that ride, yeah I'm gonna press my lime I wanna green light, I wanna be like, I wanna press my Mama, dear, spare your feelings I'm reliving moments, peeling more residual (I can) buy the building, burn the building, take your bitch, rebuild the building just to fuck some more (I can) justify my love for you and touch the sky for God to stop, debating war Put the pussy on a pedestal Put the pussy on a high horse That pussy to die for That pussy to die for Peter, piper, picked a pepper So I could pick your brain and put your heart together We depart the shady parts and party hard, the diamonds yours The coupe forever My best shots might shoot forever like (brr)  I get those goosebumps every time, yeah, you come around, yeah You ease my mind, you make everything feel fine Worry about those comments I'm way too numb, yeah, it's way too dumb, yeah I get those goosebumps every time, I need the Heimlich Throw that to the side, yeah I get those goosebumps every time, yeah, when you're not around When you throw that to the side, yeah I get those goosebumps every time|
Khalid Location |Send me your location, let's Focus on communicating 'Cause I just need the time and place to come through (place to come through) Send me your location Let's ride the vibrations I don't need nothing else but you  At times I wonder why I fool with you But this is new to me, this is new to you Initially, I didn't wanna fall for you Gather my attention it was all for you, so don't Take advantage, don't leave my heart damaged To understand that things go a little bit better when you plan it... oh  Send me your location, let's Focus on communicating 'Cause I just need the time and place to come through (place to come through) Send me your location Let's ride the vibrations I don't need nothing else but you  I don't wanna fall in love off of subtweets, so Let's get personal I got a lot of cool spots that we can go Tell me what's the move and I got you I'm only acting like this 'cause I like you Just give me the vibe to slide then Oh, I might make you mine by the night, and  Send me your location, let's Focus on communicating 'Cause I just need the time and place to come through (place to come through) Send me your location Let's ride the vibrations I don't need nothing else but you  Ride, ride, ride, come and vibe with me tonight I don't need nothing else but you (I don't need nothing else but you) Ride, ride, ride, come and vibe with me tonight I don't need nothing else but you Nothing else but you Do, do, do, do, do, do Oh, oh, mmm, mmm, mmm, mmm Oh, oh, oh Oh, oh, oh, mmm, mmm, mmm Do, do, do, do, do, do, do Do, do, do, do, do, do, do I don't need nothing else but you|
|Billie Eilish| |lovely (with Khalid)| |Thought I found a way Thought I found a way, yeah (found) But you never go away (never go away) So I guess I gotta stay now  Oh, I hope some day I'll make it out of here Even if it takes all night or a hundred years Need a place to hide, but I can't find one near Wanna feel alive, outside I can fight my fear  Isn't it lovely, all alone Heart made of glass, my mind of stone Tear me to pieces, skin and bone Hello, welcome home  Walkin' out of town Lookin' for a better place (Lookin' for a better place) Something's on my mind Always in my headspace  Oh, I hope some day I'll make it out of here Even if it takes all night or a hundred years Need a place to hide, but I can't find one near Wanna feel alive, outside I can fight my fear  Isn't it lovely, all alone Heart made of glass, my mind of stone Tear me to pieces, skin and bone Hello, welcome home  Woah, yeah Yeah, ah Woah, woah Hello, welcome home|
Lauv |I Like Me Better| |To be young and in love in New York City To not know who I am but still know that I'm good long as you're here with me To be drunk and in love in New York City Midnight into morning coffee Burning through the hours talking  Damn  I like me better when I'm with you I like me better when I'm with you I knew from the first time, I'd stay for a long time 'Cause I like me better when I like me better when I'm with you  I don't know what it is but I got that feeling Waking up in this bed next to you, swear the room-yeah-it got no ceiling If we lay, let the day just pass us by I might get to too much talking, I might have to tell you something  Damn  I like me better when I'm with you I like me better when I'm with you I knew from the first time, I'd stay for a long time 'Cause I like me better when I like me better when I'm with you  Stay awhile stay awhile Stay here with me Stay awhile stay awhile, oh Stay awhile stay awhile Stay here with me Right here with me Yeah, yeah  I like me better when I'm with you (Yes, I do, yes, I do, babe) I like me better when I'm with you I knew from the first time I'd stay for a long time 'Cause I like me better when I like me better when I'm with you  I like me, I like me Look who you made me, made me, oh no Better when  I like me better when I'm with you|
|Charlie Puth| Attention |You've been runnin' round, runnin' round, runnin' round throwin' that dirt all on my name 'Cause you knew that I, knew that I, knew that I'd call you up You've been going round, going round, going round every party in LA 'Cause you knew that I, knew that I, knew that I'd be at one  I know that dress is karma, perfume regret You got me thinking 'bout when you were mine And now I'm all up on ya, what you expect But you're not coming home with me tonight  You just want attention You don't want my heart Maybe you just hate the thought of me with someone new Yeah, you just want attention I knew from the start You're just making sure I'm never gettin' over you  You've been runnin' round, runnin' round, runnin' round throwing that dirt all on my name 'Cause you knew that I, knew that I, knew that I'd call you up Baby, now that we're, now that we're, now that we're right here standing face to face You already know, already know, already know that you won Oh  I know that dress is karma (dress is karma), perfume regret You got me thinking 'bout when you were mine (You got me thinking 'bout when you were mine) And now I'm all up on ya (all up on ya), what you expect (Oh baby) But you're not coming home with me tonight (oh no)  You just want attention You don't want my heart Maybe you just hate the thought of me with someone new Yeah, you just want attention I knew from the start You're just making sure I'm never gettin' over you Oh  What are you doin' to me? What are you doin', huh? (What are you doin'?) What are you doin' to me? What are you doin', huh? (What are you doin'?) What are you doin' to me? What are you doin', huh? (What are you doin'?) What are you doin' to me? What are you doin', huh?  I know that dress is karma, perfume regret You got me thinking 'bout when you were mine And now I'm all up on ya, what you expect But you're not coming home with me tonight  You just want attention You don't want my heart Maybe you just hate the thought of me with someone new Yeah, you just want attention I knew from the start You're just making sure I'm never gettin' over you (Over you)  What are you doin' to me? (hey) What are you doin', huh? (What are you doin', what?) What are you doin' to me? What are you doin', huh? (Yeah, you just want attention) What are you doin' to me? (I knew from the start) What are you doin' huh? (You're just making sure I'm never gettin' over you) What are you doin' to me? What are you doin', huh?|
|The Chainsmokers| Closer |Hey, I was doing just fine just before I met you I drink too much and that's an issue but I'm okay Hey, you tell your friends it was nice to meet them But I hope I never see them again  I know it breaks your heart Moved to the city in a broke down car and Four years, no calls Now you're looking pretty in a hotel bar and I can't stop No, I-I-I-I can't stop  So baby, pull me closer In the back seat of your Rover That I know you can't afford Bite that tattoo on your shoulder  Pull the sheets right off the corner Of the mattress that you stole From your roommate back in Boulder We ain't ever getting older  We ain't ever getting older We ain't ever getting older  You look as the good as the day as I met you I forgot just why I left you, I was insane Stay and play that Blink-One Eighty-Two song That we beat to death in Tucson, okay?  I know it breaks your heart I moved to the city in a broke down car and Four years, no calls Now I'm looking pretty in a hotel bar and I can't stop No, I-I-I-I can't stop  So baby, pull me closer In the backseat of your Rover That I know you can't afford Bite that tattoo on your shoulder  Pull the sheets right off the corner Of the mattress that you stole From your roommate back in Boulder We ain't ever getting older  We ain't ever getting older We ain't ever getting older  So baby, pull me closer In the backseat of your Rover That I know you can't afford Bite that tattoo on your shoulder  Pull the sheets right off the corner Of the mattress that you stole From your roommate back in Boulder We ain't ever getting older  We ain't ever getting older (we ain't ever getting older) We ain't ever getting older (we ain't ever getting older) We ain't ever getting older (we ain't ever getting older) We ain't ever getting older  We ain't ever getting older No we ain't ever getting older|
|Lil Skies| |Red Roses (feat. Landon Cube)| |And I got all the drugs in the world that you need We get high to pass time but bitch I ain't no fiend I got money on my mind, I be stacking my green Shawty said she like my style, I be dripping with ease Please don't send me naked pictures, I don't like to be teased Say she got that super soaker, well girl just let me see I ain't worried bout shit, these niggas ain't scaring me I was destined for this life, this is my destiny Friends wanna be friends when you doing the most How you tell me you my bro then you went out and told Niggas say they down to ride but be folding like clothes Purple hearts all on my garment, I ain't trusting a soul  I roll up the Mary Jane, no they can't feel my pain I'm still trapping everyday, I think I'm stuck in my ways If you looking for a handout get the fuck out my face I don't care about no friends because they all were just fake In my inbox like I owe you, I got this by myself I was broken down bad when you said you would help Now I'm up, they love to hate me, that's just bad for your health And she say she a college girl but left her books on the shelf She gon' fuck me like a porn star, a rock star Trying to skirt off in that fast car, like NASCAR Girl you know I got a cold heart If I would give it to you, would you tear that shit apart Red roses on my grave, bury me with art And with some Backwoods and a lighter just so I could spark Midnight rider, never put the car in park I'm shining bright just like a light 'cause I came from the dark I ain't never had nobody, put that on my mommy I might have to catch a body if you try to stop me She ride like a Kawasaki and she like it sloppy Oh you got a hotty body, come ride on my Johnny Imma go show you the wave, just give me some space Why you all up in my face like you need a taste Good designer on my waist, shooters keep the K I tell them boys to play it safe, don't lay in your grave I ain't never taking time off, I'm steady grinding I'm never lying, was never crying Take flights I'm flying, no you can't see me Say you need me but you deceive me  And I got all the drugs in the world that you need We get high to pass time but bitch I ain't no fiend I got money on my mind, I be stacking my green Shawty said she like my style, I be dripping with ease Please don't send me naked pictures, I don't like to be teased Say she got that super soaker, well girl just let me see I ain't worried bout shit, these niggas ain't scaring me I was destined for this life, this is my destiny Friends wanna be friends when you doing the most How you tell me you my bro then you went out and told Niggas say they down to ride but be folding like clothes Purple hearts all on my garment, I ain't trusting a soul  I ain't never forgotten, not a soul worth remembering Cause all these motherfuckers turn to foe when they envy So I don't talk, I work hard Cause you could be someone today and just be nobody tomorrow She said I'll never be shit but a god damn rock star That blunt ash on the floor Well she ain't that far off Said she ain't that far off Roll, smoke That's all we know Toke Took a drag out that wood now she goin' for my wood So we going to my hood Yeah she gonna get it good And she know who we are She want this rock star life and she said I'm going far And she off a bar And she can't feel her face no more Yeah she off a bar and she can't feel her face no more She said she can't feel her face no more|
